{
  "$schema": "http://json-schema.org/draft-04/schema#",
  "title": "Erik's AST-Optimized Resume",
  "type": "object",
  "properties": {
    "basics": {
      "type": "object",
      "properties": {
        "name": { "type": "string" },
        "label": { "type": "string" },
        "email": { "type": "string", "format": "email" },
        "phone": { "type": "string" },
        "url": { "type": "string" },
        "location": {
          "type": "object",
          "properties": {
            "city": { "type": "string" },
            "region": { "type": "string" },
            "postalCode": { "type": "string" }
          },
          "required": ["city", "region"]
        }
      },
      "required": ["name", "email"]
    },
    "summary": { "type": "string" },
    "summary_short": { "type": "string" },
    "experience": {
      "type": "array",
      "items": {
        "type": "object",
        "properties": {
          "company": { "type": "string" },
          "position": { "type": "string" },
          "location": { "type": "string" },
          "startDate": { "type": "string" },
          "endDate": { "type": ["string", "null"] },
          "highlights": {
            "type": "array",
            "items": { "type": "string" }
          }
        },
        "required": ["company", "position"]
      }
    },
    "skills": {
      "type": "array",
      "items": {
        "type": "object",
        "properties": {
          "name": { "type": "string" },
          "keywords": {
            "type": "array",
            "items": { "type": "string" }
          }
        }
      }
    },
    "education": {
      "type": "array",
      "items": {
        "type": "object",
        "properties": {
          "institution": { "type": "string" },
          "area": { "type": "string" },
          "studyType": { "type": "string" }
        }
      }
    },
    "certificates": {
      "type": "array",
      "items": {
        "type": "object",
        "properties": {
          "issuer": { "type": "string" },
          "name": { "type": "string" }
        }
      }
    }
  },
  "required": ["basics", "experience"]
}

